{
  "schema": "aml-verifier-implementation-claim/1",
  "prototype": true,
  "implementation_id": "aru-aml-http-reference",
  "implementation_version": "1",
  "runtime": "Node HTTP reference service",
  "source_url": "https://github.com/aruintelligence/aml-core/blob/main/server/aml-http.js",
  "contract_snapshot_id": "aml-verifier-contract-2026-09-08-01",
  "contract_source_commit": "b1ff5a87c7b19ae6338503a58ab6257a5b2add0b",
  "artifact_types": ["aml-witness-bundle/1"],
  "conformance_command": "POST /v1/verify-witness-bundle",
  "conformance_result_url": null,
  "external_to_aml_core": false,
  "claim_boundary": "AML-maintained HTTP reference implementation claim. It does not count as an external witness or independent institution."
}
