{
  "schema": "aml-verifier-implementation-claim/1",
  "prototype": true,
  "implementation_id": "aru-aml-python-reference",
  "implementation_version": "1",
  "runtime": "Python standard library",
  "source_url": "https://github.com/aruintelligence/aml-core/blob/main/independent/python/verify_witness.py",
  "contract_snapshot_id": "aml-verifier-contract-2026-09-08-01",
  "contract_source_commit": "b1ff5a87c7b19ae6338503a58ab6257a5b2add0b",
  "artifact_types": ["aml-witness-bundle/1"],
  "conformance_command": "python3 independent/python/verify_witness.py --now 2030-01-01T00:05:00Z bundle.json",
  "conformance_result_url": null,
  "external_to_aml_core": false,
  "claim_boundary": "AML-maintained reference implementation claim. It demonstrates an in-repository Python target for the immutable verifier snapshot but is not an external witness or independent institution."
}
